{
  "$schema": "http://json-schema.org/draft-07/schema#",
  "$id": "https://npdev.dev/schemas/conversion-hook.schema.json",
  "title": "NPDev Conversion Hook",
  "description": "An operator-authored SQL conversion hook (schema-engine rebuild, Phase 7 -- rule-6 sanctioned destruction): declares which Impact-Report item keys the hook resolves, so ConversionHookRunner can match it against the live schema diff. Validated at GENERATION time by com.npdev.generator.dbconfig.ConversionHookEmitter; a copy of this schema also lives at NPDevGenerator/generator/src/main/resources/schema/conversion-hook.schema.json for classpath access during generation -- keep the two byte-identical.",
  "type": "object",
  "additionalProperties": false,
  "required": ["id", "claims"],
  "properties": {
    "id": {
      "type": "string",
      "minLength": 1,
      "description": "Stable identity for this hook. Used as the classpath folder name (db/conversion-hooks/<id>/) and recorded verbatim in npdev_schema_history."
    },
    "claims": {
      "type": "array",
      "minItems": 1,
      "items": { "type": "string", "minLength": 1 },
      "description": "Canonical Impact-Report item keys (SchemaDiffItem.itemKey()) this hook resolves. A hook whose claims intersect the live diff's unresolved item-key set is selected; a hook that matches nothing is skipped (INFO, not an error)."
    },
    "description": {
      "type": "string",
      "description": "Human-readable summary of what this hook does, for operator review."
    },
    "verifySql": {
      "type": "string",
      "description": "Optional read-only SQL statement returning a single row/column count, run after the hook's convert SQL to confirm it did what it claims."
    },
    "verifyExpect": {
      "type": "integer",
      "default": 0,
      "description": "The count verifySql must return. Defaults to 0 (e.g. \"no rows left unconverted\")."
    }
  }
}
